{
  "typ": "abendlauf",
  "datum": "2026-10-22",
  "erstellt": "2026-10-22T21:20:00Z",
  "notiz": "Abendlauf ohne Handlungsbedarf: keine abgeschlossenen Orders, daher keine Berichte, Lektionen oder Gewichtsvorschläge. Keine offenen Ereignisse. SpaceX liegt bei -6,5 % knapp über dem Stop (127,64 €) – Stop bleibt, keine Anpassung ohne neuen Grund; Capital One unverändert (+0,2 %). Auffällig: Kurswächter meldet für beide Positionen zeitweise 'kein Kurs', obwohl gettex-Kurse um 19:43/19:44 UTC vorliegen – bitte beobachten. Simulation mit fiktivem Geld – keine Anlageberatung, keine Kauf- oder Verkaufsempfehlung."
}
