{
  "typ": "mittagslauf",
  "datum": "2026-10-27",
  "erstellt": "2026-10-27T15:05:00Z",
  "briefing": [
    "Gentherm +9 % heute, über dem Ziel – Stop auf Einstand nach Gebühren angehoben.",
    "Kursraketen AZTR/GCTK/CLRO ohne belegten Auslöser – keine spekulative Order.",
    "Keine neue Order im Mittagslauf."
  ],
  "anpassungen": [
    {
      "orderId": "2026-10-27-gentherm-inc",
      "feld": "stop",
      "neu": 26.9,
      "begruendung": "Kurs +6,5 % seit Kauf und über dem Ziel; keine neue Meldung gefunden. Stop auf ca. Einstand nach Gebühren, damit der Gewinn nicht zum Verlust wird."
    }
  ],
  "notiz": "Websuchen: Gentherm ohne aktuelle Meldung (Anstieg vermutlich Insider-Kauf-Nachlauf), AZTR nur Spam-Seiten ohne seriöse Quelle oder Pflichtmeldung. Werbe-Warnung greift → keine Order. Simulation mit fiktivem Geld – keine Anlageberatung, keine Kauf- oder Verkaufsempfehlung."
}
