{
  "typ": "wochenrueckblick",
  "datum": "2026-10-31",
  "erstellt": "2026-10-31T09:15:00Z",
  "wochenrueckblick": {
    "push": "Woche: −149,41 € (ETF +51,62 €) · 4/8 im Plus · Learning: Nachzahlen-Drift trägt nicht · Gewicht Insider-Cluster ↓ · Daytrading −1.434 € · Note 4,6",
    "text": "## Wochenrückblick KW 44\n\n**Ergebnis:** 8 Orders geschlossen, netto **−149,41 €** nach Gebühren, Trefferquote 50 %. Der MSCI World hätte in denselben Zeiträumen **+51,62 €** gebracht – also rund 200 € schlechter als der ETF. Erwartet waren Ø +0,75 % je Order, erreicht wurden Ø −2,07 %. Offen ist noch Stewart Information Services (+2,4 %, Hälfte schon verkauft).\n\n**Wochenzeugnis (Code): Note 4,6 – mangelhaft.** Das ist berechtigt: Depot und Daytrading verlieren klar. Gut sind nur die Kalibrierung (5,6 Punkte daneben), die Tagesprognose (70 % richtig, n=10) und das Schattenbuch (56,6 % im Plus nach 1 Tag).\n\n**Was funktioniert hat**\n- Tagesprognosen ohne Geld: 7 von 10 in der richtigen Richtung, Ø +3,95 %.\n- Im Schattenbuch: `nachricht` (Ø +3,7 % nach 1 Woche, n=25) und `volumen_ungewoehnlich` (Ø +4,7 %, n=7, noch sehr klein).\n- Gentherm (Insider-Cluster + Hochstufung) und Galaxy (echter Geschäftswandel) waren Lichtblicke.\n\n**Was nicht funktioniert hat**\n- **Nachzahlen-Drift** in großen US-Werten: Ø −2,0 % (n=8), im Schattenbuch Ø −0,7 % (n=17). Der Markt preist schnell ein.\n- **Insider-Signale allein:** Cluster Ø −2,2 % (n=34), Einzelkauf Ø −2,1 % (n=32), Volltreffer 0 %. Der Code hat die Gewichte richtigerweise gesenkt (Cluster 3 → 2,67, die größte Änderung).\n- **Spekulation:** 1 Order, −14 % (Rapport vor Studiendaten).\n- **Daytrading:** 124 Trades, Quote 24 %, **−1.433,54 €**. Turbos (−868 €) und ORB short (Ø −0,38 R) sind das Hauptleck; ORB long bei Aktien liegt nahe null.\n\n**Kalibrierung:** Alle Konfidenzen lagen bei 40–59 %, getroffen wurden 50 % – die Chancen passen. Aber die **Renditeerwartung** war zu hoch: Die Verluste waren größer als die Gewinne. Der Fehler liegt also beim Verhältnis von Ziel zu Stop, nicht bei der Trefferquote.\n\n**Hot Stuff:** Nur 20 % der Raketen hatten Vorzeichen in unseren Daten. Wiederkehrend sind Nasdaq-Handelsstopps vor Kursstürzen (AXG, GBC) und Upbit-Warnungen (MPLX). Insider-Kauf zeigt einen Lift von 1,24 – kaum besser als Zufall.\n\n**Fokus nächste Woche**\n1. Keine reinen Drift- oder Insider-Käufe mehr, nur noch mit Zusatzsignal (Hochstufung, Geschäftswandel, `nachricht`).\n2. Ziel/Stop an der Tagesschwankung ausrichten und die erwartete Rendite ehrlich aus Konfidenz × Ziel + Rest × Stop rechnen.\n3. Hebel weiter nur bei belegter Volltreffer-Quote – bisher trägt das allein `kursrakete` (15 %, n=13), und das ist zu wenig für einen mittelfristigen Turbo.\n4. Daytrading: Für die Monatsprüfung (7.11.) Belege sammeln, ob ORB short und Turbos pausiert werden sollten.\n\n*Simulation mit fiktivem Geld – keine Anlageberatung, keine Kauf- oder Verkaufsempfehlung.*"
  }
}
