{
  "typ": "morgenlauf",
  "datum": "2026-10-28",
  "erstellt": "2026-10-28T06:55:00Z",
  "briefing": [
    "Galaxy Digital nach starken Zahlen (bereinigtes EPS 0,83 $, Aktie +9,6 %) – Kauf vorgemerkt, Drift-Test",
    "Stewart Information: 5 Insider kauften vor den Zahlen heute Abend – Kauf vorgemerkt; Rapport plant Kapitalerhöhung",
    "Heute: Fed-Entscheid; nach US-Schluss Alphabet, Ford, FedEx, Carvana"
  ],
  "orders": [
    {
      "wertpapier": {
        "name": "Galaxy Digital Inc.",
        "isin": "US36317J2096",
        "ticker": "GLXY",
        "anlageklasse": "aktie",
        "spreadKlasse": "aktie_large",
        "handelsplatz": "TGT",
        "steuertopf": "aktien",
        "kursbasis": { "markt": "us", "symbol": "GLXY", "waehrung": "USD" }
      },
      "strategie": "nachzahlen_drift",
      "these": "Galaxy Digital drehte im dritten Quartal 2026 von einem Verlust (Q2: −0,09 $ je Aktie) auf einen Gewinn von 323 Mio. $, bereinigtes EPS 0,83 $ statt erwarteter rund −0,14 $. Das Rechenzentrum Helios liefert jetzt planbare Mieteinnahmen von CoreWeave (ca. 80 Mio. $ je Quartal). Der Markt bestätigte mit +9,6 % bei rund 1,6-fachem Normalvolumen. Die Aktie notiert trotzdem nahe dem Jahrestief (Spanne 14–39 $) – Raum für eine mehrtägige Drift.",
      "ausloeser": "Gewinnüberraschung +713 % und bestätigende Kursreaktion +9,6 % laut Lagebild vom 28.10.",
      "signalIds": [
        "gewinn_ueberraschung:GLXY:2026-10-28",
        "nachzahlen_drift:GLXY:2026-10-28"
      ],
      "quellen": [
        { "name": "Galaxy Q3-2026-Pressemitteilung (SEC 8-K)", "link": "https://www.sec.gov/Archives/edgar/data/0001859392/000185939226000108/glxy-20260930xpressrelease.htm" },
        { "name": "Galaxy Investor Relations", "link": "https://investor.galaxy.com/static-files/f325cc7a-50b8-48a8-b669-9a53584badca" }
      ],
      "konfidenz": 45,
      "pflichtOrder": false,
      "erwarteteRenditeNetto": 1.0,
      "zielNettoProzent": 12,
      "stopProzent": -8,
      "verkaufstermin": "2026-11-11T15:00:00Z",
      "risiken": [
        "Sehr hohe Schwankung (Beta ca. 3,8) – stark vom Kryptomarkt abhängig",
        "Gewinn stammt zum Teil aus Bewertungsgewinnen des Portfolios, nicht aus wiederkehrendem Geschäft",
        "In früheren Quartalen fiel die Aktie nach Zahlen teils zweistellig – Reaktionen sind unberechenbar",
        "Fed-Entscheid heute Abend kann Risikoanlagen bewegen"
      ],
      "einflussLektionen": "Lektion 2 umgesetzt: erwartete Rendite = 0,45 × 12 + 0,55 × (−8) ≈ 1,0. Lektion 3: Ziel und Stop weit, weil die Tagesschwankung hoch ist. Statistik hat erst n=1 – Drift-Strategie bewusst an einem volatilen Wert testen."
    },
    {
      "wertpapier": {
        "name": "Stewart Information Services Corp.",
        "isin": "US8603721015",
        "wkn": "887667",
        "ticker": "STC",
        "anlageklasse": "aktie",
        "spreadKlasse": "aktie_neben",
        "handelsplatz": "TGT",
        "steuertopf": "aktien",
        "kursbasis": { "markt": "us", "symbol": "STC", "waehrung": "USD" }
      },
      "strategie": "insider_kauf",
      "these": "Fünf Insider des Titelversicherers Stewart kauften am 23.10. zusammen für 0,46 Mio. $ eigene Aktien (gemeldet 27.10.) – wenige Tage vor den Quartalszahlen, die laut Kalender heute (28.10.) erscheinen. Ein Cluster mehrerer Führungskräfte direkt vor den Zahlen deutet auf Zuversicht. Erwartet wird eine Aufwärtsdrift über zwei Wochen, gestützt durch das Zahlen-Ereignis.",
      "ausloeser": "Insider-Cluster-Kauf (5 Personen, Form 4) im Lagebild vom 28.10., Quartalszahlen heute",
      "signalIds": ["insider_cluster_kauf:STC:2026-10-28"],
      "quellen": [
        { "name": "OpenInsider STC", "link": "http://openinsider.com/STC" },
        { "name": "onvista Stewart Information Services", "link": "https://www.onvista.de/aktien/STEWART-INFORMATION-SERVICES-CORP-Aktie-US8603721015" }
      ],
      "konfidenz": 48,
      "pflichtOrder": false,
      "erwarteteRenditeNetto": -0.2,
      "zielNettoProzent": 4,
      "stopProzent": -4,
      "verkaufstermin": "2026-11-11T15:00:00Z",
      "risiken": [
        "Quartalszahlen heute – Kurssprung in beide Richtungen möglich",
        "Kaufsumme der Insider gering (0,46 Mio. $), Cluster per Websuche nicht unabhängig bestätigt",
        "Titelversicherer hängen stark an Hypothekenzinsen und Immobilienmarkt (Fed heute)",
        "Geringe Tagesschwankung: 4 % netto nach 2,2 % Gebühren ist ambitioniert"
      ],
      "einflussLektionen": "Lektion 1 (Insider-Cluster bei Nebenwerten brauchbar, schwach, n=1) gibt den Ausschlag für einen zweiten Insider-Test. Lektion 2: 0,48 × 4 + 0,52 × (−4) ≈ −0,2 – ehrlich knapp unter null wegen der Gebührenhürde. Lektion 4: Einzelgewinn Gentherm nicht überbewerten, daher Konfidenz unter 50."
    }
  ],
  "anpassungen": [
    {
      "orderId": "2026-10-26-rapport-therapeutics-inc",
      "feld": "verkaufstermin",
      "neu": "2026-11-04T15:00:00Z",
      "begruendung": "Rapport kündigte am 27.10. eine Aktienplatzierung plus Wandelanleihe an (SEC 424B5). Verwässerung schwächt die Insider-These; Haltedauer verkürzt, Stop bleibt."
    }
  ],
  "notiz": "Spekulative Kursraketen (NUWE, BRAI, AIOK) bewusst ausgelassen: keine unabhängige Bestätigung geprüft, ISINs unklar. Boeing-Short nicht umgesetzt, da kein geprüftes Knock-out-Produkt. Kurswächter meldete für alle Positionen 'kein Kurs' (vermutlich nur nachts) – beobachten."
}
