{
  "typ": "mittagslauf",
  "datum": "2026-10-28",
  "erstellt": "2026-10-28T14:58:00Z",
  "briefing": [
    "Mittagslauf: keine neue Order – keine Kursrakete mit belegbarem Auslöser.",
    "Rapport Therapeutics: Ereignis vom Morgen erledigt, Position bereits per Stop geschlossen."
  ],
  "notiz": "Ereignis Rapport (+8,7 % am Morgen): die Position ist laut letzter Push bereits per Stop geschlossen und nicht mehr offen, daher keine Anpassung. Gelegenheiten: NUWE (Nuwellis, +75 %), BRAI (Braiin, +56 %), AIOK (AI Okto, +47 %) – die Websuche fand für heute keine Meldung, Pflichtveröffentlichung oder seriöse Nachricht als Auslöser. Bei BRAI und NUWE gab es schon mehrfach ähnliche Sprünge, die wieder verpufften. AIOK hat eine sehr kleine Streubesitzmenge (~1,1 Mio. Stück) und ist nach dem Schiffsverkauf vom 23.10. schon stark gelaufen – Pump-Gefahr, Bewegung wohl weitgehend vorbei. Die gettex-Ausschläge betreffen HSBC-Hebelprodukte ohne bekannten Basiswert. Spekulativ bisher 0 % Trefferquote (n=1) → ohne echten Auslöser nichts kaufen."
}
