{
  "typ": "mittagslauf",
  "datum": "2026-10-26",
  "erstellt": "2026-10-26T14:58:00Z",
  "briefing": [
    "Keine neue Order: Kursraketen ohne belastbaren Auslöser.",
    "Offene Positionen ohne neue Ereignisse; SpaceX −5,7 %, Stop noch nicht erreicht."
  ],
  "orders": [],
  "anpassungen": [],
  "notiz": "Mittagslauf ohne Order. AIOK (+183 %): Spin-off von Toro seit 08.10., 74 % beim CEO, keine Meldung zum Anstieg gefunden – wirkt wie Pump, außerdem fraglich auf gettex. CLRO (+69 %): letzte belegte Meldung (Cortigent-Fusion) von August, kein aktueller Auslöser gefunden. Übrige Raketen (LYCA, BOLT, MYND, zwei Hebelprodukte) ohne Recherche-Budget bzw. Hebelprodukte ohne erkennbaren Basiswert-Auslöser. Die Alpha-Vantage-Gewinner stammen vermutlich vom Vortag; die Bewegung ist dann schon gelaufen. Offene Positionen: keine neuen Ereignisse, keine Anpassung nötig. Quellen: https://www.stocktitan.net/sec-filings/AIOK/ , https://stockanalysis.com/stocks/CLRO . Simulation mit fiktivem Geld – keine Anlageberatung, keine Kauf- oder Verkaufsempfehlung."
}
