{
  "typ": "mittagslauf",
  "datum": "2026-10-29",
  "erstellt": "2026-10-29T15:10:00Z",
  "orders": [],
  "anpassungen": [],
  "notiz": "Keine neue Order. Keine offenen Ereignisse und keine Autopilot-Käufe seit dem Morgen. SpaceX (−6,8 %) steht kurz vor dem Stop 127,64 €; der Wächter verkauft dort, eine Anpassung ist nicht nötig. Galaxy (+8,7 %) und Stewart (+4,5 %) laufen planmäßig, die Hälfte ist schon verkauft, der Stop steht auf Einstand. Gelegenheiten: US-Kursraketen (ULBI, AIOK, KPTI, FTFT, BOOM) und gettex-Hebelprodukte ohne belegten Auslöser; zu Heidelberger Druck (−22 % in einer Stunde) und Karyopharm (+73 %) habe ich keine Meldung von heute gefunden. Bewegung schon gelaufen, Pump-Risiko hoch, Kursraketen im Schattenbuch nur 43 % nach 1 Tag → nichts mit Chance ≥ 40 % und positivem Erwartungswert. Simulation mit fiktivem Geld – keine Anlageberatung, keine Kauf- oder Verkaufsempfehlung."
}
