{
  "typ": "mittagslauf",
  "datum": "2026-10-23",
  "erstellt": "2026-10-23T14:58:00Z",
  "briefing": [
    "Keine neue Order: keine Kursrakete mit belegbarem Auslöser von heute.",
    "Lithia-Ereignis (+8,2 %) lag vor unserem Kauf; Position nahezu unverändert (−0,1 %), These intakt.",
    "SpaceX −5,0 % nähert sich dem Stop (127,64 €), kein neuer Anlass für eine Anpassung."
  ],
  "notiz": "Ereignis Lithia: Der Tagesausschlag von +8,15 % ist die fortgesetzte Reaktion auf die Zahlen vom 21.10. und war bereits im Kaufkurs (256,79 €) enthalten; jetzt 256,60 €, deutlich über dem Stop von 238,82 € → keine Anpassung. Gelegenheiten: SHFS (+122 %, 0,34 $) – erneute Spitze ohne gefundene Meldung; die Firma hat eine laufende Aktienverkaufs-Vereinbarung (Verwässerungsrisiko), typische Pump-Muster. XLAB (+73 %) – der letzte belegte Auslöser (GPU-Server-Auftrag, SEC-Meldung) stammt vom 16.–19.10., heute nichts Neues gefunden. STAK (+67 %) – Low-Float-Momentum, kein aktueller Auslöser gefunden. Bei allen dreien ist der Großteil der Bewegung vorbei, gettex-Handel unklar → kein Einstieg. Quellen: https://www.tipranks.com/news/why-is-shf-holdings-stock-shfs-up-150-today, https://stockstotrade.com/news/exascale-labs-holdings-inc-xlab-news-2026_10_19-3/, https://www.quiverquant.com/news/STAK+stock+surges+as+AI+power+expansion+story+collides+with+low-float+momentum. Simulation mit fiktivem Geld – keine Anlageberatung, keine Kauf- oder Verkaufsempfehlung."
}
