{
  "typ": "mittagslauf",
  "datum": "2026-10-22",
  "erstellt": "2026-10-22T14:58:00Z",
  "briefing": [
    "Keine neue Order: keine Kursrakete mit belegbarem Auslöser gefunden.",
    "SpaceX-Ereignis (+7,8 %) ist der Zahlen-Tag, schon eingepreist; These intakt, keine Anpassung.",
    "Capital One +2,7 %, SpaceX −2,6 % – beide innerhalb von Ziel/Stop."
  ],
  "notiz": "Ereignis SpaceX: Der gemeldete Ausschlag von +7,79 % ist die Reaktion auf die Zahlen vom 20.10. und war die Grundlage der These. Kurs jetzt 135,20 € (−2,6 %), weit über dem Stop von 127,64 €. These intakt → keine Anpassung. Gelegenheiten: SHFS (+72 %, 0,15 $) und SPHL (+54 %) – per Websuche kein aktueller Auslöser (Meldung/Pflichtveröffentlichung) für heute zu finden; SHFS ist für Kapitalerhöhungen und Kursspitzen ohne Substanz bekannt, und bei SPHL sehen Quellen oft reines Micro-Cap-Momentum. XHLD/WHLR/AHT: Penny-/REIT-Spitzen ohne geprüften Auslöser; gettex-Handel und ISIN unklar. Bei den gettex-Hebelprodukten (HSBC/GS) ist der Basiswert unbekannt, die Bewegungen kommen vermutlich von Hebeleffekten bei geringem Umsatz. Mit +40–70 % ist der Großteil der Bewegung vorbei → kein Einstieg. Simulation mit fiktivem Geld – keine Anlageberatung, keine Kauf- oder Verkaufsempfehlung."
}
