{
  "typ": "abendlauf",
  "datum": "2026-10-21",
  "erstellt": "2026-10-21T16:12:00Z",
  "notiz": "Abendlauf ohne Aufgaben: keine offenen Positionen, keine abgeschlossenen Orders ohne Bericht, keine Statistik für Lektionen oder Gewichtsvorschläge. Simulation mit fiktivem Geld – keine Anlageberatung, keine Kauf- oder Verkaufsempfehlung."
}
