{
  "typ": "wochenrueckblick",
  "datum": "2026-10-24",
  "erstellt": "2026-10-24T08:10:00Z",
  "wochenrueckblick": {
    "push": "Woche: 0,00 € realisiert (ETF 0,00 €) · 4 offen, 1/4 im Plus, Buch ≈ −57 € · Learning: Nachzahlen-Drift noch unbelegt · Gewichte unverändert",
    "text": "## Wochenrückblick 19.–24.10.2026\n\n**Ergebnis:** Noch keine Order abgeschlossen – realisiert 0,00 € nach Gebühren, Vergleich MSCI World daher ebenfalls 0,00 €. Offen sind 4 Positionen (alle Strategie *Nachzahlen-Drift* nach Quartalszahlen), Buchwert gegenüber Kaufkurs zusammen ca. −57 € vor Verkaufsgebühren:\n\n- SpaceX: −5,5 % (≈ −54 €), Stop bei 127,64 € ist nur noch ca. 2,6 % entfernt.\n- Lithia Motors: +1,6 % (≈ +13 €) – einzige Position im Plus.\n- Capital One: −1,1 % (≈ −10 €).\n- Elevance Health: −0,8 % (≈ −7 €).\n\n**Was funktioniert hat:** Die Abläufe – Signal → Order → Ausführung zum Briefkurs am nächsten Kurscheck – liefen sauber; alle vier Käufe wurden mit gettex-Kursen ausgeführt.\n\n**Was nicht:** Die SpaceX-Wette auf Fortsetzung nach +7,8 % am Zahlentag kippt bisher: Nach einem starken Sprung mit Rekordvolumen ist ein Teil der Bewegung offenbar schon eingepreist. Merkposten: Nach sehr großen Erstreaktionen ist Drift weniger wahrscheinlich als nach moderaten (wie bei Capital One angenommen).\n\n**Auffällige Quellen/Signale:** Alle Ideen stammen aus Quartalszahlen-Überraschungen. Das Depot ist damit einseitig auf eine Strategie und auf US-Werte konzentriert; ein Marktrückgang trifft alle Positionen gleichzeitig.\n\n**Kalibrierung:** Angegebene Gewinnchancen 45–50 % sind angesichts der 2,2-%-Gebührenhürde realistisch-vorsichtig. Aussagekraft frühestens ab ca. 10 abgeschlossenen Orders; Gewichte und Risiko-Budget bleiben auf Grundeinstellung.\n\n**Hinweis Technik:** Der Kurswächter meldete für alle vier Werte zuletzt „kein Kurs“ – am Wochenende erwartbar; am Montag prüfen, ob gettex wieder Kurse liefert.\n\n**Fokus nächste Woche:** Erste Abschlüsse sauber auswerten (SpaceX-Stop, Lithia-Ziel), Strategien streuen (z. B. Insider-Käufe, Analysten-Hochstufungen, ein ETF/Krypto-ETN), Kriterium „Größe der Erstreaktion“ bei Nachzahlen-Drift mitschreiben.\n\n*Simulation mit fiktivem Geld – keine Anlageberatung, keine Kauf- oder Verkaufsempfehlung.*"
  }
}
