{
  "typ": "morgenlauf",
  "datum": "2026-10-27",
  "erstellt": "2026-10-27T06:55:00Z",
  "briefing": [
    "Gentherm: 2 Direktoren kauften für 0,66 Mio. $, dazu mehr Kaufempfehlungen – Kauf vorgemerkt",
    "Hartford nach Zahlen gestern Abend (EPS 3,50 $ statt 3,21 $) – Kauf vorgemerkt, Drift-Test",
    "Heute vor US-Start: Boeing, Coca-Cola, PayPal, UPS; nach Schluss Visa"
  ],
  "orders": [
    {
      "wertpapier": {
        "name": "Gentherm Inc.",
        "isin": "US37253A1034",
        "ticker": "THRM",
        "anlageklasse": "aktie",
        "spreadKlasse": "aktie_neben",
        "handelsplatz": "TGT",
        "steuertopf": "aktien",
        "kursbasis": { "markt": "us", "symbol": "THRM", "waehrung": "USD" }
      },
      "strategie": "insider_kauf",
      "these": "Zwei Direktoren von Gentherm kauften am 23.10. zusammen für 0,66 Mio. $ eigene Aktien (gemeldet 26.10.), einer davon allein 0,53 Mio. $. Gleichzeitig stieg der Anteil der Kaufempfehlungen von 64 % auf 73 %. Cluster-Käufe von Direktoren nach der Modine-Kombination deuten auf Zuversicht ins neue Geschäft; erwartet wird eine langsame Aufwärtsdrift über zwei bis drei Wochen.",
      "ausloeser": "Insider-Cluster-Kauf (Form 4) plus Analysten-Hochstufung im Lagebild vom 27.10.",
      "signalIds": [
        "insider_cluster_kauf:THRM:2026-10-27",
        "insider_kauf:THRM:2026-10-27",
        "analysten_hochstufung:THRM:2026-10-27"
      ],
      "quellen": [
        { "name": "OpenInsider THRM", "link": "http://openinsider.com/THRM" },
        { "name": "Börse Stuttgart Gentherm", "link": "https://www.boerse-stuttgart.de/en/products/equities/stuttgart/a1j4ac-gentherm-inc/" }
      ],
      "konfidenz": 42,
      "pflichtOrder": false,
      "erwarteteRenditeNetto": 1.0,
      "zielNettoProzent": 4,
      "stopProzent": -7,
      "verkaufstermin": "2026-11-17T15:00:00Z",
      "risiken": [
        "Quartalszahlen voraussichtlich Ende Oktober/Anfang November – Kurssprung in beide Richtungen",
        "Integration des Modine-Geschäfts und neue Aktien können den Kurs belasten",
        "Autozulieferer-Branche konjunkturabhängig",
        "Kaufbetrag der Insider gemessen an der Firmengröße eher klein"
      ],
      "einflussLektionen": "Noch keine Lektionen und keine abgeschlossene Statistik. Bewusst eine Insider-Order statt einer weiteren reinen Drift-Order, weil 4 von 5 offenen Positionen nachzahlen_drift sind – so lernt die Statistik mehr über Signaltypen."
    },
    {
      "wertpapier": {
        "name": "The Hartford Insurance Group, Inc.",
        "isin": "US4165151048",
        "ticker": "HIG",
        "anlageklasse": "aktie",
        "spreadKlasse": "aktie_large",
        "handelsplatz": "TGT",
        "steuertopf": "aktien",
        "kursbasis": { "markt": "us", "symbol": "HIG", "waehrung": "USD" }
      },
      "strategie": "nachzahlen_drift",
      "these": "Hartford meldete am 26.10. nach US-Schluss ein EPS von 3,50 $ statt erwarteter 3,21 $ (+9 %). Bei Versicherern mit stabilen Margen folgt auf solide Überraschungen oft eine mehrtägige Drift; die Telefonkonferenz am 27.10. um 15 Uhr (Berlin 14 Uhr) kann den Ausblick bestätigen. Gekauft wird erst beim nächsten Kurscheck, also nach der ersten Reaktion.",
      "ausloeser": "Gewinnüberraschung +9 % laut Lagebild, Zahlen nach Börsenschluss am 26.10.",
      "signalIds": ["gewinn_ueberraschung:HIG:2026-10-27"],
      "quellen": [
        { "name": "The Hartford Q3-Termin (IR)", "link": "https://s206.q4cdn.com/854710405/files/doc_news/2026/Sep/28/09282026-Q3-Save-the-Date-Final.pdf" },
        { "name": "comdirect HIG", "link": "https://www.comdirect.de/inf/aktien/US4165151048" }
      ],
      "konfidenz": 40,
      "pflichtOrder": false,
      "erwarteteRenditeNetto": 0.5,
      "zielNettoProzent": 3,
      "stopProzent": -4,
      "verkaufstermin": "2026-11-10T15:00:00Z",
      "risiken": [
        "Reaktion nach Börsenschluss unbekannt – Überraschung kann schon eingepreist sein",
        "Vor einem Jahr fiel die Aktie trotz Gewinnüberraschung um 1,8 %",
        "Schadenquoten, Rückstellungen oder schwacher Ausblick in der Telefonkonferenz",
        "Geringe Schwankung: Ziel nach 2,2 % Gebühren ist ambitioniert"
      ],
      "einflussLektionen": "Noch keine Lektionen; Statistik leer. Drift-Order bewusst mit niedrigerer Konfidenz, weil die offenen Drift-Positionen bisher überwiegend im Minus liegen (SpaceX −4,9 %, Elevance −3,1 %)."
    }
  ],
  "notiz": "Offene Positionen ohne neue relevante Meldungen; keine Anpassungen. Rapport (−7,6 %) liegt nahe am Stop 21,58 € – bewusst nicht geändert. Kursraketen AZTR/GCTK/CLRO ohne unabhängige Bestätigung, daher keine spekulative Order. FMP-Konnektor: Kurs- und Insider-Abfragen im aktuellen Tarif gesperrt."
}
