{
  "typ": "mittagslauf",
  "datum": "2026-10-30",
  "erstellt": "2026-10-30T15:05:00Z",
  "orders": [],
  "anpassungen": [],
  "notiz": "Mittagslauf ohne neue Order. Stewart (insider_kauf) +4,9 %, Hälfte schon verkauft, Stop auf Einstand, Ziel 41,37 € nah – keine Meldung dagegen, keine Anpassung. Kein Autopilot-Kauf. Kursraketen BURU (+118 %), PCLA (+89 %), NCPL, INLF: per Websuche kein seriöser Auslöser gefunden (nur automatisch erzeugte Kursseiten, BURU mit Pump-Vorgeschichte), Bewegung schon gelaufen → Pump-Verdacht, kein Kauf. Upbit-Sprünge (MPLX, BEAM, PUNDIX) verpuffen laut Regel oft binnen Stunden. HSBC-Hebelpapier −31 % ist ein Knock-out-Effekt, kein Signal. Simulation mit fiktivem Geld – keine Anlageberatung, keine Kauf- oder Verkaufsempfehlung."
}
